{
  "$schema": "http://json-schema.org/draft-07/schema#",
  "title": "json-schema-legacy/maindoc/UBL-TransportProgressStatus-2.3.json",
  "description": "\n  Library:           OASIS Universal Business Language (UBL) 2.3 OS\n                     http://docs.oasis-open.org/ubl/os-UBL-2.3/\n  Release Date:      15 June 2021\n  Module:            json-schema-legacy/maindoc/UBL-TransportProgressStatus-2.3.json\n  Generated on:      2021-12-15 21:56z\n  Copyright (c) OASIS Open 2021. All Rights Reserved.\n\n\n  OASIS takes no position regarding the validity or scope of any \n  intellectual property or other rights that might be claimed to pertain \n  to the implementation or use of the technology described in this \n  document or the extent to which any license under such rights \n  might or might not be available; neither does it represent that it has \n  made any effort to identify any such rights. Information on OASIS's \n  procedures with respect to rights in OASIS specifications can be \n  found at the OASIS website. Copies of claims of rights made \n  available for publication and any assurances of licenses to be made \n  available, or the result of an attempt made to obtain a general \n  license or permission for the use of such proprietary rights by \n  implementors or users of this specification, can be obtained from \n  the OASIS Executive Director.\n\n  OASIS invites any interested party to bring to its attention any \n  copyrights, patents or patent applications, or other proprietary \n  rights which may cover technology that may be required to \n  implement this specification. Please address the information to the \n  OASIS Executive Director.\n  \n  This document and translations of it may be copied and furnished to \n  others, and derivative works that comment on or otherwise explain \n  it or assist in its implementation may be prepared, copied, \n  published and distributed, in whole or in part, without restriction of \n  any kind, provided that the above copyright notice and this \n  paragraph are included on all such copies and derivative works. \n  However, this document itself may not be modified in any way, \n  such as by removing the copyright notice or references to OASIS, \n  except as needed for the purpose of developing OASIS \n  specifications, in which case the procedures for copyrights defined \n  in the OASIS Intellectual Property Rights document must be \n  followed, or as required to translate it into languages other than \n  English. \n\n  The limited permissions granted above are perpetual and will not be \n  revoked by OASIS or its successors or assigns. \n\n  This document and the information contained herein is provided on \n  an \"AS IS\" basis and OASIS DISCLAIMS ALL WARRANTIES, \n  EXPRESS OR IMPLIED, INCLUDING BUT NOT LIMITED TO ANY \n  WARRANTY THAT THE USE OF THE INFORMATION HEREIN \n  WILL NOT INFRINGE ANY RIGHTS OR ANY IMPLIED \n  WARRANTIES OF MERCHANTABILITY OR FITNESS FOR A \n  PARTICULAR PURPOSE.    \n",
  "required": [
    "TransportProgressStatus"
    ],
  "properties": {
    "_D": {
      "description": "Document ABIE XML namespace string",
      "type": "string"
      },
    "_A": {
      "description": "Library ABIE XML namespace string (for ASBIEs)",
      "type": "string"
      },
    "_B": {
      "description": "BBIE XML namespace string",
      "type": "string"
      },
    "_E": {
      "description": "Extension scaffolding XML namespace string",
      "type": "string"
      },
    "TransportProgressStatus": {
      "description": "A document sent from a Transportation Network Manager to a Transport Service Provider giving the status of the whereabouts and schedule of the transport means involved in a transport service.",
      "items": {
        "$ref": "#/definitions/TransportProgressStatus"
        },
      "maxItems": 1,
      "minItems": 1,
      "type": "array"
      }
    },
  "additionalProperties": false,
  "type": "object",
  "definitions": {
    "TransportProgressStatus": {
      "title": "Transport Progress Status. Details",
      "description": "A document sent from a Transportation Network Manager to a Transport Service Provider giving the status of the whereabouts and schedule of the transport means involved in a transport service.",
      "required": [
        "ID",
        "IssueDate",
        "IssueTime",
        "TransportMeans"
        ],
      "properties": {

        "UBLExtensions": {
          "title": "UBLExtensions",
          "description": "An optional set of extensions to the committee model",
          "items": { 
            "$ref": "../common/UBL-CommonExtensionComponents-2.3.json#/definitions/UBLExtensions" },
          "maxItems": 1,
          "minItems": 1,
          "type": "array"
          },

        "UBLVersionID": {
          "title": "Transport Progress Status. UBL Version Identifier. Identifier",
          "description": "Identifies the earliest version of the UBL 2 schema for this document type that defines all of the elements that might be encountered in the current instance.",
          "items": {
            "$ref": "../common/UBL-CommonBasicComponents-2.3.json#/definitions/UBLVersionID"
            },
          "maxItems": 1,
          "minItems": 1,
          "type": "array"
          },
        "CustomizationID": {
          "title": "Transport Progress Status. Customization Identifier. Identifier",
          "description": "Identifies a user-defined customization of UBL for a specific use.",
          "items": {
            "$ref": "../common/UBL-CommonBasicComponents-2.3.json#/definitions/CustomizationID"
            },
          "maxItems": 1,
          "minItems": 1,
          "type": "array"
          },
        "ProfileID": {
          "title": "Transport Progress Status. Profile Identifier. Identifier",
          "description": "Identifies a user-defined profile of the customization of UBL being used.",
          "items": {
            "$ref": "../common/UBL-CommonBasicComponents-2.3.json#/definitions/ProfileID"
            },
          "maxItems": 1,
          "minItems": 1,
          "type": "array"
          },
        "ProfileExecutionID": {
          "title": "Transport Progress Status. Profile Execution Identifier. Identifier",
          "description": "Identifies an instance of executing a profile, to associate all transactions in a collaboration.",
          "items": {
            "$ref": "../common/UBL-CommonBasicComponents-2.3.json#/definitions/ProfileExecutionID"
            },
          "maxItems": 1,
          "minItems": 1,
          "type": "array"
          },
        "ID": {
          "title": "Transport Progress Status. Identifier",
          "description": "An identifier for this document, assigned by the sender.",
          "items": {
            "$ref": "../common/UBL-CommonBasicComponents-2.3.json#/definitions/ID"
            },
          "maxItems": 1,
          "minItems": 1,
          "type": "array"
          },
        "CopyIndicator": {
          "title": "Transport Progress Status. Copy_ Indicator. Indicator",
          "description": "Indicates whether this document is a copy (true) or not (false).",
          "items": {
            "$ref": "../common/UBL-CommonBasicComponents-2.3.json#/definitions/CopyIndicator"
            },
          "maxItems": 1,
          "minItems": 1,
          "type": "array"
          },
        "UUID": {
          "title": "Transport Progress Status. UUID. Identifier",
          "description": "A universally unique identifier for an instance of this document.",
          "items": {
            "$ref": "../common/UBL-CommonBasicComponents-2.3.json#/definitions/UUID"
            },
          "maxItems": 1,
          "minItems": 1,
          "type": "array"
          },
        "IssueDate": {
          "title": "Transport Progress Status. Issue Date. Date",
          "description": "The date, assigned by the sender, on which this document was issued.",
          "items": {
            "$ref": "../common/UBL-CommonBasicComponents-2.3.json#/definitions/IssueDate"
            },
          "maxItems": 1,
          "minItems": 1,
          "type": "array"
          },
        "IssueTime": {
          "title": "Transport Progress Status. Issue Time. Time",
          "description": "The time, assigned by the sender, at which this document was issued.",
          "items": {
            "$ref": "../common/UBL-CommonBasicComponents-2.3.json#/definitions/IssueTime"
            },
          "maxItems": 1,
          "minItems": 1,
          "type": "array"
          },
        "Note": {
          "title": "Transport Progress Status. Note. Text",
          "description": "Free-form text pertinent to this document, conveying information that is not contained explicitly in other structures.",
          "items": {
            "$ref": "../common/UBL-CommonBasicComponents-2.3.json#/definitions/Note"
            },
          "minItems": 1,
          "type": "array"
          },
        "StatusAvailableIndicator": {
          "title": "Transport Progress Status. Status Available_ Indicator. Indicator",
          "description": "Indicates whether transport progress information is available.",
          "items": {
            "$ref": "../common/UBL-CommonBasicComponents-2.3.json#/definitions/StatusAvailableIndicator"
            },
          "maxItems": 1,
          "minItems": 1,
          "type": "array"
          },
        "Signature": {
          "title": "Transport Progress Status. Signature",
          "description": "A signature applied to this document.",
          "items": {
            "$ref": "../common/UBL-CommonAggregateComponents-2.3.json#/definitions/Signature"
            },
          "minItems": 1,
          "type": "array"
          },
        "SenderParty": {
          "title": "Transport Progress Status. Sender_ Party. Party",
          "description": "The party sending the Transport Progress Status.",
          "items": {
            "$ref": "../common/UBL-CommonAggregateComponents-2.3.json#/definitions/SenderParty"
            },
          "maxItems": 1,
          "minItems": 1,
          "type": "array"
          },
        "ReceiverParty": {
          "title": "Transport Progress Status. Receiver_ Party. Party",
          "description": "The party receiving the Transport Progress Status.",
          "items": {
            "$ref": "../common/UBL-CommonAggregateComponents-2.3.json#/definitions/ReceiverParty"
            },
          "maxItems": 1,
          "minItems": 1,
          "type": "array"
          },
        "SourceIssuerParty": {
          "title": "Transport Progress Status. Source Issuer_ Party. Party",
          "description": "The party that is the source of the Transport Progress Status.",
          "items": {
            "$ref": "../common/UBL-CommonAggregateComponents-2.3.json#/definitions/SourceIssuerParty"
            },
          "maxItems": 1,
          "minItems": 1,
          "type": "array"
          },
        "TransportProgressStatusRequestDocumentReference": {
          "title": "Transport Progress Status. Transport Progress Status Request_ Document Reference. Document Reference",
          "description": "A reference to the Transport Progress Status Request document to which this status report is a response.",
          "items": {
            "$ref": "../common/UBL-CommonAggregateComponents-2.3.json#/definitions/TransportProgressStatusRequestDocumentReference"
            },
          "maxItems": 1,
          "minItems": 1,
          "type": "array"
          },
        "TransportMeans": {
          "title": "Transport Progress Status. Transport Means",
          "description": "The transport means by which the current transport service is effectuated.",
          "items": {
            "$ref": "../common/UBL-CommonAggregateComponents-2.3.json#/definitions/TransportMeans"
            },
          "maxItems": 1,
          "minItems": 1,
          "type": "array"
          },
        "TransportSchedule": {
          "title": "Transport Progress Status. Transport Schedule",
          "description": "Describes the status and schedule of the transport means operating the transport service as well as the current location of the transport means.",
          "items": {
            "$ref": "../common/UBL-CommonAggregateComponents-2.3.json#/definitions/TransportSchedule"
            },
          "minItems": 1,
          "type": "array"
          }
        },
      "additionalProperties": false,
      "type": "object"
      }
    }
  }
