{"_D":"urn:oasis:names:specification:ubl:schema:xsd:TransportProgressStatus-2",
 "_A":"urn:oasis:names:specification:ubl:schema:xsd:CommonAggregateComponents-2",
 "_B":"urn:oasis:names:specification:ubl:schema:xsd:CommonBasicComponents-2",
 "TransportProgressStatus":[{
 "UBLVersionID":[{"_":"2.1"}],
 "ID":[{"_":"TPSR_1"}],
 "IssueDate":[{"_":"2011-10-03"}],
 "IssueTime":[{"_":"14:30:10+01:00"}],
 "StatusAvailableIndicator":[{"_":true}],
 "SenderParty":[{
  "PartyIdentification":[{
   "ID":[{"_":"4058673821325",
    "schemeAgencyName":"GS1",
    "schemeName":"GLN"}]
  }],
  "PartyName":[{
   "Name":[{"_":"ARRIVA"}]
  }],
  "Contact":[{
   "Name":[{"_":"SomeName"}],
   "Telephone":[{"_":"+49450557888"}],
   "ElectronicMail":[{"_":"SomeName@arriva.de"}]
  }]
 }],
 "ReceiverParty":[{
  "PartyIdentification":[{
   "ID":[{"_":"4058673827641",
    "schemeAgencyName":"GS1",
    "schemeName":"GLN"}]
  }],
  "PartyName":[{
   "Name":[{"_":"NECOSS"}]
  }],
  "Contact":[{
   "Name":[{"_":"SomeName"}],
   "Telephone":[{"_":"+49450557000"}],
   "ElectronicMail":[{"_":"SomeName@necoss.de"}]
  }]
 }],
 "SourceIssuerParty":[{
  "PartyIdentification":[{
   "ID":[{"_":"4058673821325",
    "schemeAgencyName":"GS1",
    "schemeName":"GLN"}]
  }],
  "PartyName":[{
   "Name":[{"_":"ARRIVA"}]
  }],
  "Contact":[{
   "Name":[{"_":"SomeName"}],
   "Telephone":[{"_":"+49450557888"}],
   "ElectronicMail":[{"_":"SomeName@arriva.de"}]
  }]
 }],
 "TransportProgressStatusRequestDocumentReference":[{
  "ID":[{"_":"TPS_1",
   "schemeName":"MovementReferenceNumber"}]
 }],
 "TransportMeans":[{
  "JourneyID":[{"_":"RHamBrem"}],
  "RegistrationNationalityID":[{"_":"DE"}],
  "TransportMeansTypeCode":[{"_":"230"}],
  "RailTransport":[{
   "TrainID":[{"_":"RID01235"}]
  }]
 }],
 "TransportSchedule":[{
  "SequenceNumeric":[{"_":1}],
  "ReliabilityPercent":[{"_":80}],
  "StatusLocation":[{
   "LocationTypeCode":[{"_":"13"}],
   "Address":[{
    "ID":[{"_":"4568763527610",
     "schemeAgencyName":"GS1",
     "schemeName":"GLN"}],
    "StreetName":[{"_":"Ludwig-Erhard-Str. 15"}],
    "CityName":[{"_":"Bremen"}],
    "Country":[{
     "IdentificationCode":[{"_":"DE"}]
    }]
   }]
  }],
  "EstimatedArrivalTransportEvent":[{
   "Period":[{
    "StartDate":[{"_":"2011-10-03"}],
    "StartTime":[{"_":"18:30:10+01:00"}],
    "EndDate":[{"_":"2011-10-03"}],
    "EndTime":[{"_":"18:35:10+01:00"}]
   }]
  }]
 }]
}]}